55120,South West,The Cotswo,E14000991,17/07/2017,1,1,1,Voted,68.0,coming out of the EU AND what might happen,Conservatives,Very interested,10 Right,10 Pay a great deal of attention,Yes,Telegraph,No,Yes,No,No,"GBP 15,600 - GBP 20,799",It belongs to a Housing Association,No religion,,No,Male,English/Welsh/Scottish/Northern Irish/British,Retired from paid work,Yes
55122,South West,The Cotswo,E14000991,19/09/2017,1,1,2,Voted,47.0,terrorism.its getting closer all the time. we now know people who have been involved. its out of control,None/No party,Not very interested,7,4,No,,No,Yes,No,No,"GBP 50,000 - GBP 59,999",Own home on mortgage,Christian - no denomination,Never or practically never,No,Male,English/Welsh/Scottish/Northern Irish/British,Working full time -  employee (30+ hours),
55124,South West,The Cotswo,E14000991,08/07/2017,1,1,2,Not voted-unregistered,29.0,-1,,Not at all interested,Don`t know,0 Pay no attention,No,,No,No,No,Yes,Don`t know,Rented from private landlord,No religion,,No,Female,English/Welsh/Scottish/Northern Irish/British,Looking after the family or home,Yes
55217,South West,The Cotswo,E14000991,26/09/2017,1,1,2,,62.0,population growth.infrastruction is at breaking point.not enough money to cope with it.,Conservatives,Fairly interested,7,8,Yes,Mail,No,Yes,No,No,Refused,Own home outright,No religion,,No,Male,English/Welsh/Scottish/Northern Irish/British,Retired from paid work,Yes
55218,South West,The Cotswo,E14000991,25/09/2017,1,1,2,Voted,61.0,"we have a tory government, they should not have put the referendum to the country",Labour,Fairly interested,4,10 Pay a great deal of attention,No,,No,Yes,No,Yes,Refused,Own home outright,No religion,,No,Female,English/Welsh/Scottish/Northern Irish/British,Looking after the family or home,Yes
55220,South West,The Cotswo,E14000991,18/09/2017,1,1,1,,70.0,housing. not enough supply for the demand effecting prices. renting and owning,Labour,Very interested,3,10 Pay a great deal of attention,Yes,Guardian/Observer,No,Yes,No,Yes,"GBP 5,200 - GBP 10,399",It belongs to a Housing Association,Other Christian,Varies too much to say,No,Female,English/Welsh/Scottish/Northern Irish/British,Retired from paid work,Yes
55223,South West,The Cotswo,E14000991,12/07/2017,1,1,1,Not voted-registered,50.0,"to many people coming in from abroad some are ok ,but some brake the law and don,t  abide by our laws",Labour,Not very interested,2,5,No,,Yes,Yes,No,No,"GBP 10,400 - GBP 15,599",Rented from local authority,Christian - no denomination,Never or practically never,No,Male,English/Welsh/Scottish/Northern Irish/British,Not working because long-term sick or disabled,Yes
55715,South West,Truro and,E14001003,14/08/2017,1,1,1,Voted,73.0,security   country  as   a  whole   from  terroism,Conservatives,Very interested,7,9,Yes,Mail,No,Yes,No,Yes,"GBP 5,200 - GBP 10,399",Own home outright,Church of England/ Anglican/Episcopal,Never or practically never,No,Female,English/Welsh/Scottish/Northern Irish/British,Retired from paid work,Yes
55718,South West,Truro and,E14001003,24/07/2017,1,1,1,,86.0,too many  immagrants        not  enough   facilities   for  our own,Labour,Not very interested,2,2,No,,Yes,No,No,No,Refused,Own home outright,Methodist,Never or practically never,No,Female,English/Welsh/Scottish/Northern Irish/British,Retired from paid work,Yes
55720,South West,Truro and,E14001003,31/07/2017,1,1,1,Voted,75.0,huge  over  spend    we   live  beyond  are   means .,Conservatives,Fairly interested,7,3,Yes,Times,No,No,No,No,"GBP 20,800 - GBP 25,999",Own home outright,Church of England/ Anglican/Episcopal,Less often but at least twice a year,No,Male,English/Welsh/Scottish/Northern Irish/British,Retired from paid work,Yes
55721,South West,Truro and,E14001003,31/07/2017,1,1,2,Not voted-unregistered,19.0,n h s    not  enough funding,Don`t know,Fairly interested,4,3,No,,No,No,Yes,Yes,Don`t know,Rented from private landlord,No religion,,No,Female,English/Welsh/Scottish/Northern Irish/British,Working part time - employee (8-29 hours),
55723,South West,Truro and,E14001003,31/07/2017,1,1,1,Voted,81.0,immigration       too  many  immigrants   being   let  in,United Kingdom Independence Party (UKIP),Not very interested,8,7,No,,Yes,No,No,No,"GBP 10,400 - GBP 15,599",Rented from local authority,Church of England/ Anglican/Episcopal,Never or practically never,No,Male,Refused,Retired from paid work,Yes
55724,South West,Truro and,E14001003,06/08/2017,1,1,1,,87.0,the   goverment     she   keeps  changing   her  mind,Labour,Not very interested,6,2,No,,Yes,Yes,No,No,Refused,Own home outright,No religion,,No,Female,English/Welsh/Scottish/Northern Irish/British,Retired from paid work,Yes
55806,South West,Truro and,E14001003,04/08/2017,1,1,1,,95.0,nhs     it  does not  have   enough  money,Conservatives,Not very interested,9,2,No,,No,Yes,No,No,Refused,Own home outright,Church of England/ Anglican/Episcopal,Never or practically never,No,Female,English/Welsh/Scottish/Northern Irish/British,Retired from paid work,Yes
55823,South West,Truro and,E14001003,31/08/2017,1,1,1,Voted,80.0,breexit  the  future  depends  on  sorting  it  out,Conservatives,Very interested,7,10 Pay a great deal of attention,Yes,Times,No,Yes,No,No,"GBP 20,800 - GBP 25,999",Own home outright,No religion,,No,Male,English/Welsh/Scottish/Northern Irish/British,Retired from paid work,Yes
55910,South West,West Dorse,E14001031,19/07/2017,1,1,1,Not voted-unregistered,61.0,"I find that people don't respect themselves, others, the countryside, animals. They have lost that respect and if one has a view then this is not respected either, for example, the Brexit debate. News is very poisonous at the moment but not",Conservatives,Not at all interested,5,4,Yes,Telegraph,No,No,No,Yes,"GBP 10,400 - GBP 15,599",Own home outright,Buddhist,Never or practically never,No,Female,English/Welsh/Scottish/Northern Irish/British,Retired from paid work,Yes
55917,South West,West Dorse,E14001031,01/08/2017,1,1,2,Not voted-unregistered,23.0,"The NHS where they are all going on strike, and the money cos I know part of the building of Dorchester hospital. I used to work at the hospital. They said the hospital had gone down hill and the decision was to close part of it..",Labour,Not at all interested,3,4,No,,No,No,No,Yes,"GBP 10,400 - GBP 15,599",Own home on mortgage,No religion,,Yes: trade union,Female,English/Welsh/Scottish/Northern Irish/British,Working full time -  employee (30+ hours),
55920,South West,West Dorse,E14001031,17/08/2017,1,1,1,,75.0,"NHS, not enough funding and administration in NHS is appalling and waste money employing ban staff instead of permanaent staff, issuing repeat prescriptions year in and out and never checking if they need these prescriptions. Won' employ en",None/No party,Fairly interested,7,6,Yes,Telegraph,No,Yes,No,No,"GBP 5,200 - GBP 10,399",Own home outright,Church of England/ Anglican/Episcopal,Less often but at least once in two weeks,No,Female,English/Welsh/Scottish/Northern Irish/British,Retired from paid work,Yes
55923,South West,West Dorse,E14001031,27/07/2017,1,1,2,Not voted-unregistered,62.0,"Getting out of the EU, the quicker the better",Conservatives,Very interested,7,10 Pay a great deal of attention,Yes,Mail,No,No,No,Yes,"GBP 10,400 - GBP 15,599",Own home outright,No religion,,No,Female,Refused,None of these,Yes
55924,South West,West Dorse,E14001031,20/07/2017,1,1,2,Not voted-unregistered,67.0,London is the biggest problem. I think an awful lot of people think London is a separate country. London has a very insular view on what it thinks are the important objectives of the whole of great Britain.,None/No party,Fairly interested,5,9,Yes,Times,No,Yes,No,Yes,"GBP 45,000 - GBP 49,999",Own home outright,No religion,,No,Male,English/Welsh/Scottish/Northern Irish/British,Retired from paid work,Yes
56002,South West,West Dorse,E14001031,20/07/2017,1,1,1,Voted,62.0,"National health, the pressure of too many users because of people coming into the country and not enough money putting in to the system and people using the system who have not put money into it.",None/No party,Not very interested,1,4,No,,No,Yes,No,No,"GBP 2,600 - GBP 5,199",It belongs to a Housing Association,Buddhist,Never or practically never,No,Male,English/Welsh/Scottish/Northern Irish/British,Working part time - employee (8-29 hours),
56115,South West,Weston-Sup,E14001038,17/09/2017,1,1,2,Not voted-registered,59.0,"the economy, high percentage of the worlds wealth is owned by small percentage of the population, they get richer and others get poorer",Labour,Fairly interested,3,7,No,,No,Yes,No,No,"GBP 31,200 - GBP 36,399",Own home outright,No religion,,No,Male,English/Welsh/Scottish/Northern Irish/British,Working full time -  employee (30+ hours),
56117,South West,Weston-Sup,E14001038,12/07/2017,1,1,1,Voted,67.0,Politics interfering with good government,Conservatives,Fairly interested,6,5,Yes,Mail,No,Yes,No,Yes,"GBP 5,200 - GBP 10,399",Own home outright,Christian - no denomination,Never or practically never,No,Female,English/Welsh/Scottish/Northern Irish/British,Retired from paid work,Yes
56120,South West,Weston-Sup,E14001038,21/09/2017,1,1,5,Not voted-unregistered,21.0,"Law on imigration, we are too open boardered, we need stricter, concerned about land space.",Don`t know,Not very interested,5,3,No,,No,No,Yes,Yes,"GBP 26,000 - GBP 31,199",Rented from private landlord,No religion,,No,Male,English/Welsh/Scottish/Northern Irish/British,Working full time - self-employed (30+ hours),
56124,South West,Weston-Sup,E14001038,22/07/2017,1,1,1,Not voted-unregistered,48.0,"Corrupt government - misuse of public money, nefarious activities happening behind the scenes, global deceptions, supression of information",None/No party,Fairly interested,5,1,No,,No,Yes,No,Yes,"Under GBP 2,600",Own home outright,No religion,,No,Female,English/Welsh/Scottish/Northern Irish/British,Working part time - self-employed (8-29 hours),
56125,South West,Weston-Sup,E14001038,26/07/2017,1,1,1,Voted,,Brexit - nobody understands it and that includes the government (uncertainty),Conservatives,Fairly interested,6,7,Yes,Telegraph,No,Yes,No,No,Refused,Own home outright,Church of England/ Anglican/Episcopal,Less often but at least twice a year,No,Male,English/Welsh/Scottish/Northern Irish/British,Retired from paid work,Yes
56201,South West,Weston-Sup,E14001038,12/07/2017,1,1,2,Voted,64.0,"Health and social care - it's underfunded, understaffed and in danger of losing more because of Brexit",Labour,Very interested,3,8,Yes,Guardian/Observer,No,Yes,Yes,Yes,"GBP 60,000 - GBP 74,999",Own home outright,Christian - no denomination,Never or practically never,No,Female,English/Welsh/Scottish/Northern Irish/British,Retired from paid work,Yes
56202,South West,Weston-Sup,E14001038,10/08/2017,1,1,2,Voted,41.0,"The government - Theresa May is rubbish - there should have been no agreement with the DUP, successive Tory led governments have  been screwing the country.",Labour,Very interested,2,9,Yes,Guardian/Observer,No,Yes,Yes,Yes,"GBP 40,000 - GBP 44,999",Own home on mortgage,No religion,,No,Female,English/Welsh/Scottish/Northern Irish/British,Working part time - self-employed (8-29 hours),
56205,South West,Weston-Sup,E14001038,19/07/2017,1,1,2,,53.0,Brexit - Idon't want to leave the Eu - it just puts jobs and the economy at risk.,None/No party,Very interested,5,8,Yes,Guardian/Observer,No,Yes,Yes,No,"GBP 60,000 - GBP 74,999",Own home outright,Church of England/ Anglican/Episcopal,Once a week or more,No,Male,English/Welsh/Scottish/Northern Irish/British,Working full time -  employee (30+ hours),
56217,South West,Weston-Sup,E14001038,12/07/2017,1,1,1,Voted,59.0,overpopulation - the population  of the country has  more than doubled in my lifetime and I dn't think that is sustainable,None/No party,Fairly interested,6,5,No,,No,Yes,No,Yes,"GBP 26,000 - GBP 31,199",Own home outright,Church of England/ Anglican/Episcopal,Less often but at least once a year,No,Male,English/Welsh/Scottish/Northern Irish/British,Working full time -  employee (30+ hours),
56218,South West,Weston-Sup,E14001038,19/07/2017,1,1,2,Voted,72.0,"Brexit - we've got to get on with it, the decision has been made.",Conservatives,Fairly interested,5,5,No,,No,Yes,No,No,"GBP 26,000 - GBP 31,199",Own home outright,Church of England/ Anglican/Episcopal,Less often but at least twice a year,No,Female,English/Welsh/Scottish/Northern Irish/British,Retired from paid work,Yes
56220,South West,Weston-Sup,E14001038,15/07/2017,1,1,2,Voted,71.0,"we've become a racially prejudice nation - society has become fractured. Brexit divided the country, indyref, nationalist movements, seperatism.",None/No party,Very interested,5,5,No,,No,Yes,No,No,"GBP 60,000 - GBP 74,999",Own home outright,Christian - no denomination,Once a week or more,No,Male,English/Welsh/Scottish/Northern Irish/British,Retired from paid work,Yes
56304,Wales,Arfon,W07000057,15/07/2017,1,1,1,,26.0,the torys joining the dup,Conservatives,Fairly interested,5,4,No,,Yes,Yes,Yes,Yes,"GBP 20,800 - GBP 25,999",Rented from local authority,No religion,,No,Male,English/Welsh/Scottish/Northern Irish/British,A full time student or pupil,Yes
56315,Wales,Arfon,W07000057,03/08/2017,1,1,2,,35.0,"Low income levels, unable to leave my children to go out to work for such a low income",Don`t know,Fairly interested,Don`t know,2,No,,Yes,No,No,Yes,"GBP 5,200 - GBP 10,399",Rented from local authority,No religion,,No,Female,English/Welsh/Scottish/Northern Irish/British,Looking after the family or home,Yes
56316,Wales,Arfon,W07000057,14/07/2017,1,1,1,,36.0,national health,Don`t know,Not at all interested,5,5,No,,No,No,No,Yes,"GBP 20,800 - GBP 25,999",It belongs to a Housing Association,No religion,,No,Female,English/Welsh/Scottish/Northern Irish/British,Working part time - employee (8-29 hours),
56319,Wales,Arfon,W07000057,14/07/2017,1,1,2,,45.0,NHS,Labour,Fairly interested,Don`t know,5,No,,Yes,No,Yes,Yes,"GBP 31,200 - GBP 36,399",Own home on mortgage,Methodist,Less often,Yes: trade union,Female,English/Welsh/Scottish/Northern Irish/British,Working full time -  employee (30+ hours),
56320,Wales,Arfon,W07000057,14/07/2017,1,1,2,,33.0,LOW JOBS,None/No party,Not at all interested,3,1,No,,Yes,No,No,Yes,"GBP 26,000 - GBP 31,199",It belongs to a Housing Association,No religion,,No,Female,English/Welsh/Scottish/Northern Irish/British,Working part time - employee (8-29 hours),
56321,Wales,Arfon,W07000057,07/08/2017,1,1,1,,75.0,brixit,Conservatives,Not at all interested,6,3,No,,No,No,No,No,"GBP 5,200 - GBP 10,399",Own home outright,No religion,,No,Male,English/Welsh/Scottish/Northern Irish/British,Retired from paid work,Yes
56323,Wales,Arfon,W07000057,18/07/2017,1,1,1,,47.0,"what will the future hold for our children, terrorism and brexit",Don`t know,Fairly interested,5,5,No,,Yes,No,No,Yes,"GBP 20,800 - GBP 25,999",Rented from local authority,Christian - no denomination,Never or practically never,Yes: trade union,Female,English/Welsh/Scottish/Northern Irish/British,Working part time - employee (8-29 hours),
56324,Wales,Arfon,W07000057,20/07/2017,1,1,2,,24.0,"HEALTHCARE/cut to the nhs, privetisation. longer waiting times",Labour,Very interested,9,7,Yes,Guardian/Observer,Yes,Yes,No,Yes,"GBP 40,000 - GBP 44,999",Own home on mortgage,No religion,,Yes: trade union,Female,English/Welsh/Scottish/Northern Irish/British,Working full time -  employee (30+ hours),
56405,Wales,Arfon,W07000057,20/07/2017,1,1,2,,79.0,BREXIT,None/No party,Fairly interested,5,5,Yes,Mail,Yes,Yes,No,No,Refused,Own home outright,Christian - no denomination,Less often but at least once in two weeks,No,Female,English/Welsh/Scottish/Northern Irish/British,Retired from paid work,Yes
56415,Wales,Arfon,W07000057,15/08/2017,1,1,3,Voted,56.0,BREXIT,None/No party,Very interested,5,10 Pay a great deal of attention,Yes,Other,Yes,Yes,Yes,Yes,"GBP 60,000 - GBP 74,999",Own home on mortgage,Christian - no denomination,Never or practically never,No,Female,English/Welsh/Scottish/Northern Irish/British,Working full time -  employee (30+ hours),
56418,Wales,Arfon,W07000057,03/08/2017,1,1,1,,80.0,"THAT THEY FOLLOW THE PEOPLE CHOICE OF BREXIT, AND NOT TO GIVE IN TO THE DEMANDS OF EUROPE/ PEOPLE WORKING FOR PENNIES, OUR COUNTRY IS WORST OFF SINCE THE EU POLICE And no food bank then, plus drugs and people sleeing on the streets",Conservatives,Very interested,3,10 Pay a great deal of attention,Yes,Financial Times,No,No,No,No,Refused,Own home outright,Christian - no denomination,Once a week or more,No,Female,English/Welsh/Scottish/Northern Irish/British,Retired from paid work,Yes
56419,Wales,Arfon,W07000057,25/07/2017,1,1,1,Voted,,immigration,Conservatives,Fairly interested,10 Right,8,Yes,Times,No,Yes,No,No,"GBP 26,000 - GBP 31,199",Own home outright,Roman Catholic,Less often but at least twice a year,No,Female,English/Welsh/Scottish/Northern Irish/British,Retired from paid work,Yes
56421,Wales,Arfon,W07000057,25/07/2017,1,1,2,Voted,67.0,IMMIGRATION,Conservatives,Not very interested,3,0 Pay no attention,No,,Yes,Yes,No,No,"GBP 20,800 - GBP 25,999",Own home outright,Christian - no denomination,Never or practically never,No,Female,English/Welsh/Scottish/Northern Irish/British,Retired from paid work,Yes
56422,Wales,Arfon,W07000057,01/08/2017,1,1,2,Voted,43.0,"divissions within society/class, within culture, within location",Plaid Cymru,Fairly interested,4,7,Yes,Guardian/Observer,No,Yes,No,Yes,"GBP 40,000 - GBP 44,999",Own home on mortgage,Christian - no denomination,Less often but at least once a month,No,Male,English/Welsh/Scottish/Northern Irish/British,Working full time - self-employed (30+ hours),
56423,Wales,Arfon,W07000057,22/09/2017,1,1,3,,24.0,TERRORISM,Labour,Fairly interested,0 Left,5,No,,No,Yes,Yes,No,"GBP 75,000 - GBP 99,999",Own home on mortgage,No religion,,No,Male,English/Welsh/Scottish/Northern Irish/British,Working full time -  employee (30+ hours),
56515,Wales,Blaenau Gw,W07000072,09/07/2017,1,1,1,Not voted-registered,49.0,employment,None/No party,Not very interested,5,3,No,,No,Yes,No,Yes,"GBP 10,400 - GBP 15,599",It belongs to a Housing Association,No religion,,No,Male,English/Welsh/Scottish/Northern Irish/British,Looking after the family or home,Yes
56517,Wales,Blaenau Gw,W07000072,03/08/2017,1,1,2,Not voted-registered,39.0,immigration.,Don`t know,Not at all interested,5,1,No,,No,No,No,No,Don`t know,Own home on mortgage,No religion,,No,Male,English/Welsh/Scottish/Northern Irish/British,Working full time - self-employed (30+ hours),
56520,Wales,Blaenau Gw,W07000072,14/07/2017,1,1,2,Not voted-registered,34.0,terrorism,Don`t know,Fairly interested,5,4,No,,No,Yes,No,Yes,"GBP 31,200 - GBP 36,399",Own home on mortgage,No religion,,Yes: trade union,Male,English/Welsh/Scottish/Northern Irish/British,Working full time -  employee (30+ hours),
56521,Wales,Blaenau Gw,W07000072,21/07/2017,1,1,2,Voted,58.0,immigrants. too many,None/No party,Not at all interested,2,1,No,,No,Yes,No,Yes,"GBP 26,000 - GBP 31,199",It belongs to a Housing Association,No religion,,No,Female,English/Welsh/Scottish/Northern Irish/British,Looking after the family or home,Yes
56522,Wales,Blaenau Gw,W07000072,13/07/2017,1,1,2,Voted,47.0,young kids cant get a mortgage,Labour,Not at all interested,5,1,No,,No,Yes,No,Yes,"GBP 10,400 - GBP 15,599",Own home on mortgage,No religion,,No,Female,English/Welsh/Scottish/Northern Irish/British,Working full time -  employee (30+ hours),
56523,Wales,Blaenau Gw,W07000072,13/07/2017,1,1,2,,47.0,immigrants taking jobs,Don`t know,Not very interested,5,1,No,,No,Yes,No,No,"GBP 45,000 - GBP 49,999",Own home outright,No religion,,Yes: trade union,Male,English/Welsh/Scottish/Northern Irish/British,Working full time -  employee (30+ hours),
56524,Wales,Blaenau Gw,W07000072,12/09/2017,1,1,3,Voted,66.0,Brexit P. The immigration more than anything. Too many coming in that weve got to provide for.,Don`t know,Very interested,6,6,Yes,Express,Yes,Yes,No,Yes,"GBP 10,400 - GBP 15,599",Own home outright,Methodist,Never or practically never,No,Female,English/Welsh/Scottish/Northern Irish/British,Retired from paid work,Yes
56525,Wales,Blaenau Gw,W07000072,08/09/2017,1,1,2,Voted,65.0,"The job situation for younger people. P People are not getting full time, it is zero hours or 16 hours. Our own family have found it hard. There are too many agencies.",None/No party,Not very interested,8,6,No,,No,Yes,No,Yes,Don`t know,Own home outright,No religion,,No,Female,English/Welsh/Scottish/Northern Irish/British,Retired from paid work,Yes
56616,Wales,Blaenau Gw,W07000072,09/07/2017,1,1,2,Voted,29.0,lack of jobs,None/No party,Fairly interested,5,5,No,,No,Yes,Yes,Yes,"GBP 10,400 - GBP 15,599",Rented from private landlord,No religion,,No,Male,English/Welsh/Scottish/Northern Irish/British,Looking after the family or home,Yes
56617,Wales,Blaenau Gw,W07000072,21/07/2017,1,1,2,Voted,42.0,brexit. feel it will cause problems being out of the eu.,Labour,Very interested,5,5,No,,Yes,Yes,No,Yes,Don`t know,Rented from private landlord,No religion,,No,Male,English/Welsh/Scottish/Northern Irish/British,Not working because temporarily sick or injured,Yes
56620,Wales,Blaenau Gw,W07000072,13/07/2017,1,1,1,Voted,60.0,"brexit. will it happen as perscribed, when we were given the info at the time of the poll",United Kingdom Independence Party (UKIP),Very interested,7,9,Yes,Mail,No,Yes,No,No,"GBP 10,400 - GBP 15,599",Own home outright,Christian - no denomination,Never or practically never,No,Male,English/Welsh/Scottish/Northern Irish/British,Retired from paid work,Yes
56621,Wales,Blaenau Gw,W07000072,13/07/2017,1,1,1,Voted,36.0,too much bad feeling in the country,Plaid Cymru,Fairly interested,1,5,No,,Yes,Yes,No,Yes,"GBP 5,200 - GBP 10,399",Own home on mortgage,No religion,,No,Female,English/Welsh/Scottish/Northern Irish/British,Unemployed and actively seeking work,Yes
56622,Wales,Blaenau Gw,W07000072,14/07/2017,1,1,2,Not voted-unregistered,24.0,Terrorism,Don`t know,Not at all interested,3,0 Pay no attention,No,,Yes,No,Yes,Yes,Don`t know,Rented from private landlord,No religion,,No,Male,English/Welsh/Scottish/Northern Irish/British,Working full time - self-employed (30+ hours),
56623,Wales,Blaenau Gw,W07000072,16/07/2017,1,1,1,Voted,25.0,terrorism,Labour,Fairly interested,3,6,Yes,Telegraph,Yes,Yes,No,Yes,"GBP 15,600 - GBP 20,799",Rented from private landlord,Christian - no denomination,Less often but at least once in two weeks,No,Female,English/Welsh/Scottish/Northern Irish/British,Working full time -  employee (30+ hours),
56624,Wales,Blaenau Gw,W07000072,19/07/2017,1,1,1,,26.0,"muslim crisis, re terrorism",Labour,Fairly interested,3,5,Yes,Sun,No,Yes,No,No,"GBP 26,000 - GBP 31,199",Rented from private landlord,Christian - no denomination,Less often but at least once a year,No,Male,English/Welsh/Scottish/Northern Irish/British,Working full time -  employee (30+ hours),
56625,Wales,Blaenau Gw,W07000072,16/07/2017,1,1,2,Not voted-registered,66.0,brexit,Conservatives,Not very interested,7,5,No,,No,Yes,No,Yes,"GBP 20,800 - GBP 25,999",Own home outright,No religion,,No,Female,English/Welsh/Scottish/Northern Irish/British,Retired from paid work,Yes
56915,Wales,Cardiff Ce,W07000050,10/07/2017,1,1,2,Not voted-unregistered,24.0,RACISM (P) Religious beliefs,Don`t know,Fairly interested,3,6,Yes,Other,No,Yes,Yes,Yes,"GBP 40,000 - GBP 44,999",Rented from private landlord,Roman Catholic,Less often but at least twice a year,No,Male,Irish,Working full time -  employee (30+ hours),
56919,Wales,Cardiff Ce,W07000050,09/07/2017,1,1,2,Not voted-unregistered,20.0,Brexit. Education and immigration in Brexit.,Liberal Democrats,Fairly interested,Don`t know,6,Yes,Independent/The i,No,Yes,Yes,Yes,Don`t know,Rented from private landlord,Church of England/ Anglican/Episcopal,Never or practically never,Yes: staff association,Male,Chinese,Working full time -  employee (30+ hours),
56924,Wales,Cardiff Ce,W07000050,15/07/2017,1,1,1,Not voted-unregistered,25.0,Brexit. p) impact on the economy which is impossible to predict,Conservatives,Not very interested,5,5,Yes,Guardian/Observer,No,Yes,No,Yes,"GBP 2,600 - GBP 5,199",Rented from private landlord,No religion,,No,Male,English/Welsh/Scottish/Northern Irish/British,A full time student or pupil,Yes
57015,Wales,Cardiff Ce,W07000050,28/07/2017,1,1,2,Voted,19.0,Brexit. P CHANGING the currency value. I have lost my old job because of it.P,Labour,Fairly interested,3,4,No,,Yes,Yes,No,Yes,"GBP 40,000 - GBP 44,999",Rented from private landlord,No religion,,No,Female,English/Welsh/Scottish/Northern Irish/British,Working full time -  employee (30+ hours),
57017,Wales,Cardiff Ce,W07000050,10/07/2017,1,1,2,Voted,23.0,"How we are going to Brexit easily without too much disruption. (P) Our future as a nation, cost of things trade between EU and us, small businesses.",Labour,Fairly interested,1,6,Yes,Telegraph,Yes,Yes,No,Yes,"GBP 5,200 - GBP 10,399",Rented from private landlord,No religion,,No,Female,English/Welsh/Scottish/Northern Irish/British,Working full time -  employee (30+ hours),
57018,Wales,Cardiff Ce,W07000050,15/07/2017,1,1,1,Not voted-unregistered,22.0,Terrorism. How to prevent attacks.,Labour,Fairly interested,3,7,Yes,Mail,No,Yes,Yes,Yes,"GBP 10,400 - GBP 15,599",Rented from private landlord,No religion,,No,Male,English/Welsh/Scottish/Northern Irish/British,Working full time -  employee (30+ hours),
57020,Wales,Cardiff Ce,W07000050,09/07/2017,1,1,7,Voted,22.0,Eu and Brexit. We have been talking about it a lot and terror too. Brexit - how that will change our ability to work abroad and immigration laws,Labour,Fairly interested,3,7,No,,Yes,Yes,Yes,Yes,"GBP 40,000 - GBP 44,999",Rented from private landlord,No religion,,No,Female,English/Welsh/Scottish/Northern Irish/British,A full time student or pupil,Yes
